,country,description,designation,points,price,province,region_1,region_2,taster_name,taster_twitter_handle,title,variety,winery
73,US,"Juicy plum, raspberry and pencil lead lead the way in this vineyard designate, a site that's 2,000 feet high. Tobacco and cedar meet a full-bodied hit of oak and puckering tannin, the wine still youthfully wrapped in its full-bodied boldness.",Bella Vetta Vineyard,86,75.0,California,Howell Mountain,Napa,Virginie Boone,@vboone,Hindsight 2013 Bella Vetta Vineyard Cabernet Sauvignon (Howell Mountain),Cabernet Sauvignon,Hindsight
74,US,This is the producer's first release of this wine. Fruity aromas of plum and tart cranberry add to its overall sense of lightness and understatement.,Estate Grown,86,55.0,California,Calistoga,Napa,Virginie Boone,@vboone,Hindsight 2012 Estate Grown Petite Sirah (Calistoga),Petite Sirah,Hindsight
75,US,"This is made from equal parts Cabernet Franc and Merlot, with small additions of Malbec. Juicy, it reveals a raisiny quality of ripeness around integrated oak and generous tannin.",The Cypher,86,75.0,California,Napa Valley,Napa,Virginie Boone,@vboone,Mulvane Wine Co. 2013 The Cypher Red (Napa Valley),Bordeaux-style Red Blend,Mulvane Wine Co.
76,Germany,"Earthy pollen and mineral notes lend a savory tone to this medium-sweet Riesling. It's soft and slightly pulpy, intensified by overripe tangerine and stone fruit flavors. Drink now through 2018.",,86,9.0,Rheinhessen,,,Anna Lee C. Iijima,,Schmitt Söhne 2015 Riesling (Rheinhessen),Riesling,Schmitt Söhne
77,Australia,"This medium-bodied Chardonnay features aromas of pineapple and roasted cashew. Similar notes of ripe pineapple and nuts mark the palate, then ease to a rather soft, easy finish. Drink now.",Made With Organic Grapes,86,18.0,South Australia,South Australia,,Joe Czerwinski,@JoeCz,Yalumba 2016 Made With Organic Grapes Chardonnay (South Australia),Chardonnay,Yalumba
78,US,"Some rosés are made simply by bleeding the juice from the fermenter, to concentrate the remaining wine. Whether or not that is the case here, the wine has the simple pleasant lightly candied strawberry flavors one might expect from such a technique. It's fruity and undemanding. Drink up.",Rosé of,86,25.0,Oregon,Eola-Amity Hills,Willamette Valley,Paul Gregutt,@paulgwine ,Z'IVO 2015 Rosé of Pinot Noir (Eola-Amity Hills),Pinot Noir,Z'IVO
79,Portugal,"Grown on the sandy soil of Tejo, the wine is typically soft and open. It is very accessible—with black fruits and light tannins for this grape. It is ready to drink.",Bridão,86,,Tejo,,,Roger Voss,@vossroger,Adega Cooperativa do Cartaxo 2014 Bridão Touriga Nacional (Tejo),Touriga Nacional,Adega Cooperativa do Cartaxo
80,Chile,"Caramelized oak and vanilla aromas are front and center on a barrel-heavy nose. This feels a bit choppy, with astringent tannins. Herbal salty plum flavors wear a lot of oaky makeup, while this finishes with a forced woody flavor.",Special Release Reserva,86,12.0,Rapel Valley,,,Michael Schachner,@wineschach,Aresti 2014 Special Release Reserva Carmenère (Rapel Valley),Carmenère,Aresti
81,Spain,"Bland, mature aromas of white fruits are on the weak side for Albariño. This feels round and oily, while briny leesy flavors lack pop and precision. A grabby aged finish is short on the free flow that this grape and region are known for. Drink immediately or wait for a newer vintage.",,86,16.0,Galicia,Rías Baixas,,Michael Schachner,@wineschach,Spyro 2014 Albariño (Rías Baixas),Albariño,Spyro
82,France,"This fruity, sweet wine is immediately attractive and ripe. With its great apricot and pineapple fruit, hints of spicy wood and balancing acidity, it's perfect as an apéritif—light and refreshing. Drink now.",La Réserve,86,11.0,France Other,Vin de France,,Roger Voss,@vossroger,Lionel Osmin & Cie 2016 La Réserve Petit Manseng (Vin de France),Petit Manseng,Lionel Osmin & Cie
83,Australia,"Pale copper in hue, this wine exudes passion fruit on the nose, while the palate delivers nuances of muskmelon as well. It's crisp, racy and medium in body, perfectly suited to summertime refreshment. Drink now.",Jester Sangiovese,86,20.0,South Australia,McLaren Vale,,Joe Czerwinski,@JoeCz,Mitolo 2016 Jester Sangiovese Rosé (McLaren Vale),Rosé,Mitolo
84,US,"A healthy addition of 13% Petite Sirah provides added weight and intensity to this wine, a soft, supple and richly conceived combination of smoky black fruit and mocha.",Classic,86,24.0,California,Napa Valley,Napa,Virginie Boone,@vboone,Napa Cellars 2014 Classic Zinfandel (Napa Valley),Zinfandel,Napa Cellars
85,Germany,"Pronounced dust, pollen and earth tones lend savoriness to this otherwise citrusy wine. Racy acidity and fresh tangerine and lemon flavors turn herbal on the finish. Drink now.",Undone Dry,86,10.0,Rheinhessen,,,Anna Lee C. Iijima,,P.J. Valckenberg 2015 Undone Dry Riesling (Rheinhessen),Riesling,P.J. Valckenberg
86,US,"Vibrant aromas of ripe pear, white flowers and melon are followed by a just off-dry palate, with lean fruit flavors.",,86,20.0,Washington,Ancient Lakes,Columbia Valley,Sean P. Sullivan,@wawinereport,Palencia 2016 Albariño (Ancient Lakes),Albariño,Palencia
87,US,"Softened tannins surround a light-bodied, lean and herbal approach to this vineyard-designate, dotted in black pepper, leather and baked cherry.",Blau Vineyards,86,55.0,California,Knights Valley,Sonoma,Virginie Boone,@vboone,Passaggio 2014 Blau Vineyards Merlot (Knights Valley),Merlot,Passaggio
88,Italy,"Subdued aromas of French oak, toast and acacia waft out of the glass. The rather lean palate offers oak-driven spice, chopped herb and a hint of citrus set against racy acidity. It's rather shy on fruit richness.",Le Mandorle Riserva,86,29.0,Tuscany,Vernaccia di San Gimignano,,Kerin O’Keefe,@kerinokeefe,Poggio Alloro 2014 Le Mandorle Riserva  (Vernaccia di San Gimignano),Vernaccia,Poggio Alloro
89,Italy,"Made primarily from Sangiovese, with some Malvasia and other white grapes, this offers aromas of red berry and a yeasty whiff of bread dough. The bright, enjoyable palate offers ripe cherry and hint of pastry cream while a note of honeydew melon marks the close.",,88,19.0,Tuscany,Toscana,,Kerin O’Keefe,@kerinokeefe,Fattoria Sardi 2015 Rosato (Toscana),Rosato,Fattoria Sardi
90,US,"This blend of Sangiovese, Malbec, Cabernet Sauvignon, Petite Sirah and other varieties plays well to type. It shows a wealth of ripe, dusty black fruit that's richly round and soft on the palate, approachable and lightly oaked.",Siena,88,23.0,California,Sonoma County,Sonoma,Virginie Boone,@vboone,Ferrari-Carano 2014 Siena Red (Sonoma County),Red Blend,Ferrari-Carano
91,US,"This wine has a touch of perceptible sweetness on its tropical nose, yet tastes dry, showing a straightforward approach to this crisp, coastal-grown variety. Apricot, melon and guava wrap around a lightness of body and texture.",,88,18.0,California,Sonoma Coast,Sonoma,Virginie Boone,@vboone,Folie à Deux 2015 Pinot Gris (Sonoma Coast),Pinot Gris,Folie à Deux
92,US,"All red Bordeaux varieties are represented in this blend, except for Petit Verdot. Together, they offer a simple tannic structure that strengthens a chewiness of leather, tobacco and a touch of cedar. Full bodied, it's a ripe, bold and brawny wine.",Magnificat,88,55.0,California,Napa Valley,Napa,Virginie Boone,@vboone,Franciscan 2013 Magnificat Meritage (Napa Valley),Meritage,Franciscan
93,Austria,"Freshness characterizes the nose: green pear, ivy leaves and citrus notes play on nose and palate. This is light footed, easy drinking and charming. Drink soon while flavors are fresh.",,88,12.0,Burgenland,,,Anne Krebiehl MW,@AnneInVino,Fuchs 2015 Grüner Veltliner (Burgenland),Grüner Veltliner,Fuchs
94,US,"Barrel notes are prominent, with aromas of Creamsicle and baking spice. The palate is broad and dry with stone-fruit and barrel flavors. It provides intrigue but the wood seems to get in the way at times.",Grand Klasse Reserve Lawrence Vineyards,88,22.0,Washington,Columbia Valley (WA),Columbia Valley,Sean P. Sullivan,@wawinereport,Gård 2014 Grand Klasse Reserve Lawrence Vineyards Viognier (Columbia Valley (WA)),Viognier,Gård
95,France,"This is a dense wine, packed with both tannins and acidity. It brings out the ageworthiness of this appellation with its rich potential and dark mineral texture. Drink this concentrated cru wine from 2018.",,88,20.0,Beaujolais,Juliénas,,Roger Voss,@vossroger,Henry Fessy 2015  Juliénas,Gamay,Henry Fessy
96,France,"The wine comes from one of the cru estates followed by this negociant house. It is a light, ripe and fruity wine. With its attractive red-berry flavors, finished with crisp acidity, it is accessible and ready to drink.",,88,18.0,Beaujolais,Régnié,,Roger Voss,@vossroger,Henry Fessy 2015  Régnié,Gamay,Henry Fessy
97,US,A wisp of bramble extends a savory tone from nose to finish on this otherwise bright bristling wine. Delicate honey tones register as off dry on the palate but balance neatly alongside flavors of freshly pressed apples and pears. The finish is marked by a touch of pencil lead. Drink now through 2020.,Ingle Vineyard,88,20.0,New York,Finger Lakes,Finger Lakes,Anna Lee C. Iijima,,Heron Hill 2015 Ingle Vineyard Riesling (Finger Lakes),Riesling,Heron Hill
98,Italy,"Forest floor, menthol, espresso, cranberry and pressed violet aromas take shape in the glass. The lean linear palate shows dried sour cherry, licorice and coffee bean alongside assertive close-grained tannins. Even though the tannins are still firm, drink sooner rather than later to capture the remaining fruit.",Dono Riserva,88,30.0,Tuscany,Morellino di Scansano,,Kerin O’Keefe,@kerinokeefe,Serpaia di Endrizzi 2010 Dono Riserva  (Morellino di Scansano),Sangiovese,Serpaia di Endrizzi
99,US,"This blends 20% each of all five red-Bordeaux varieties, showing grapy, plummy flavor that's juicy and soft on the palate. With a core of tobacco, tar and graphite, it complements the fruity with the savory, ending simply and elegantly.",Intreccio Library Selection,88,75.0,California,Napa Valley,Napa,Virginie Boone,@vboone,Soquel Vineyards 2013 Intreccio Library Selection Red (Napa Valley),Bordeaux-style Red Blend,Soquel Vineyards
